"Shawn Helton 21st Century WireEarlier this week Apple CEO Tim Cook publicly rejected an unprecedented US Federal Court order that would force the company to decrypt an iPhone linked to one of the San Bernardino shooters   a move that would have vast implications  PRIVACY & PROTECTION: Apple CEO Tim Cook challenges FBI court order to unlock private data of users (Image Source: Iphoneitalia)Breaching Public Privacy In a published open letter entitled,  A Message to Our Customers,   Apple CEO Tim Cook strikingly opposed a recent federal court ruling that would unlock a phone that s been connected to the San Bernardino Mass Shooting case.The FBI ruling stipulates that Apple must provide access for one time only. However, cyber security experts and technology companies insist this is a virtual impossibility and a guarantee that cannot be made.In theory, the decryption of the phone would be opened via a newly created operating system that would give the FBI a backdoor into the device. But according to many skeptics, this type of backdoor feature could set a very dangerous precedent, while possibly making it much easier for invaders (either government, or hacker) mining for data well into the future.In addition, the new iOS (not yet in existence) proposed in the wake of the San Bernardino shooting would give US law enforcement agencies broader access to consumer communications and other private information according to many in the tech industry. This reality was confirmed by Apple s chief executive Cook, who outlined the staggering privacy implications this past Tuesday: The FBI wants us to make a new version of the iPhone operating system, circumventing several important security features, and install it on an iPhone recovered during the investigation. In the wrong hands, this software   which does not exist today   would have the potential to unlock any iPhone in someone s physical possession. In essence, the FBI s court order demand appears to bypass basic privacy rights, and when seen in a bigger picture outside of the San Bernardino case, it could be viewed as a violation of the public s 4th Amendment.Challenging The RulingOver the past 48 hours, there s been a social media frenzy, as Facebook, Twitter and Google have all expressed their support for Apple s court battle with federal authorities. This has also included the often entertaining if not perplexing, self-proclaimed  cybersecurity legend  John McAfee of McAfee Inc., who wrote an op-ed published with Business Insider, that dissects the potential fallout of the federal court ruling in similar fashion to that of Cook.Here s some of what the controversial cyber guru turned libertarian presidential hopeful had to say about the dire security circumstances facing Apple and the world at large: Using an obscure law, written in 1789   the All Writs Act   the US government has ordered Apple to place a back door into its iOS software so the FBI can decrypt information on an iPhone used by one of the San Bernardino shooters. It has finally come to this. After years of arguments by virtually every industry specialist that back doors will be a bigger boon to hackers and to our nation s enemies than publishing our nuclear codes and giving the keys to all of our military weapons to the Russians and the Chinese, our government has chosen, once again, not to listen to the minds that have created the glue that holds this world together. Continuing, cyber expert McAfee, offered up a glimpse what could transpire in the event of a blackmail scenario if such a digital backdoor were to exist: In spite of the FBI s claim that it would protect the back door, we all know that s impossible. There are bad apples everywhere, and there only needs to be in the US government. Then a few million dollars, some beautiful women (or men), and a yacht trip to the Caribbean might be all it takes for our enemies to have full access to our secrets.   ANTIVIRUS PIONEER    John McAfee, well-known American computer programmer. (Photo businessinsider) McAfee then summarized his op-ed with a ready-made-solution to the FBI s demands by offering his services, I will, free of charge, decrypt the information on the San Bernardino phone, with my team, over a three-week period.On the surface, a sensational gauntlet has been thrown down, calling for the court of public opinion to weigh in on a very important topic concerning privacy rights. But there s much more to it This latest  privacy crisis  might be viewed through a more cynical lens, should readers choose to view this drama as a story featuring controlled opposition   especially when considering the pedigree of those supposedly opposed to the FBI s recent court order.Is it possible that Apple and others have staged opposition to this court decree as a way to bolster their public image, before eventually allowing the rights of private citizens to be abused? Both Cook and McAfee have direct links to companies plagued with security baggage such as Lockheed Martin and IBM, both of which have had their ethics put to question over the years.While there is nothing conclusive here, the public should consider this other side to the story and eliminate inconvenient possibilities in an effort to find the reality of the present circumstances, even if high profile tech leaders may appear to be saying the right things in public, purportedly in the interest of the general population.In an article featured here at 21WIRE from January of 2015, we learned of another privacy threat that should concern the public regarding biometric IDs   as facial and emotional recognition software has already been rolled out without public consent: More Orwellian technology is being rolled out, not just to make you into more of a commodity than you already are, but also to  profile  your emotions. With no regulation on this issue, corporations are basically writing the privacy rules as they go along. Do you trust them? Where is this really heading? In realty, they have no control over how third parties using their software might use images of people s faces and digital signatures of your  emotions , storing, sharing and selling that data across macro platforms. Sure, it s just another new wing of Big Data. Even social media data trawlers like Facebook has already begun moving into facial recognition of their users. So while it is compelling, and quite welcome to hear tech giants calling out the FBI s overreach, it appears that many in the technology sector have already pledged support for a growing police state apparatus by virtue of developing privacy invading software. For the moment though, it appears technology innovators Cook and McAfee, along with other social media companies, seem to be working on behalf of the public s interest, even though it could be out of concern for marketability rather than true worry about where the field of technology has been heading.Apple s iPhone and tablets introduced a biometric ID system with its thumb print login scan in 2013   a system which will store millions of biometric identifiers on Apple cloud servers. It wasn t long after the system was launched before hackers cracked the security for this biometric entry point, exposing another unspeakable privacy breach.If nothing else, it has caused a sharp debate over this pressing subject.  DIGITAL DANGER    The battle for consumer privacy hangs in the balance over the recent FBI court order. (Photo vibratingupdate)Problem, Reaction, SolutionAccording to the Guardian: For months, the FBI searched for a compelling case that would force Apple to weaken iPhone security   and then the San Bernardino shooting happened. This carefully planned legal battle has been months in the making, US officials and tech executives told the Guardian, as the government and Apple try to settle whether national security can dictate how Silicon Valley writes computer code. This past December, those of us at 21WIRE, pointed out a number of inconsistencies relating the heavily dramatized San Bernardino shooting attack. In fact, the media driven shooting attack said to have taken place at the Inland Regional Center had a laundry list of details that didn t add up.After a week of whitewashed reports regarding the shooting, a media scripted ransacking of the alleged  shooters  home (tampering with a potential crime scene) and eyewitness accounts that directly contradicted the official narrative from law enforcement, we learned that in the very room where 14 people were reportedly killed (along with 21 injured) at the Inland Regional Center, there was an  active-shooter  training drill/rehearsal, involving some of the victims almost a year before December s attack to place.Incredibly, a critical component that should be mentioned in the encryption battle involving Apple and the FBI, is that there were multiple eye-witness accounts that directly contradicted the terror-tale blamed solely on Syed Farook and Tashfeen Malik. In other words, we have an event largely hinged on a barrage of convoluted and conflicting accounts concerning the San Bernardino attack.The eye-witness accounts near the scene of the shooting, never mentioned anything about seeing a female shooter, which 21WIRE also noted this past December: In fact, authorities did apprehend a third suspect but that aspect of the case, has seemingly gone down the memory hole, as has the very detailed eye-witness testimony from Sally Abdelmageed, (an Inland Regional Center employee) in a CBS interview with Scott Pelley, which clearly states that there were three white men in tactical gear dressed in black involved in the shooting event. Abdelmageed s account, echoed that of Juan Hernandez, who was interviewed shortly after the shooting incident by a local NBC affiliate, where it was described that  three white men in military fatigues,  had fled the scene in black Chevy Impala or SUV. Despite all of this, CNN, ABC, FOX and all other media outlets on the scene   all pivoted, in unison, to validate authorities  (the FBI) revised official  Jihadi Bonnie & Clyde  story of  only 2 shooters   a husband and wife . Additionally, a close colleague from Inland Regional Center, Chris Nwadike, stated that Farook had been acting normal and that  he was quiet,  and that he had not had a disagreement with anyone at the center the day of the shooting. Furthermore, the FBI themselves revealed that both Malik and Farook had not posted radical messages on social media which had previously been reported by authorities (and dutifully repeated across the mainstream media).Even though the media eventually admitted that there were no  radical posts , the idea of  social media postings  became a central story line suggesting that Malik had somehow influenced Farook into participating in the attack. Regardless of what really happened, it seems that the FBI had the opening it needed to try to force open direct access into personal devices.Is it also possible the security agency wants access to the encrypted phone so they can plant an additional back story to a shooting case that never made any sense?Food for thought to chew on in today s digital age As the privacy vs. security battle moves forward, Reuters news agency reports: The U.S. Department of Justice filed a motion on Friday seeking to compel Apple Inc (AAPL.O) to comply with a judge s order to unlock the encrypted iPhone belonging to one of the San Bernardino shooters, portraying the tech giant s refusal as a  marketing strategy. The future of privacy hangs by a thread, as more and more divide and rule policies are being implemented at the expense of public freedoms.More to come on this story here at 21WIRE READ MORE SCI-TECH NEWS AT: 21st Century Wire Sci-Tech FilesREAD MORE DAILY SHOOTER NEWS AT: 21st Century Wire Daily Shooter Files",0
"Tune in to the Alternate Current Radio Network (ACR) for another LIVE broadcast of  The Boiler Room  starting at 6 PM PST | 9 PM EST every Wednesday.Join us for uncensored, uninterruptible talk radio, custom-made for barfly philosophers, misguided moralists, masochists, street corner evangelists, media-maniacs, savants, political animals and otherwise lovable rascals.Join ACR hosts Hesher, & Spore along with Andy Nowicki from Alt Right Blogspot, Daniel Spaulding from Soul of the East, 21Wire & ACR contributor Randy J and Boiler Room Presidential Candidate select: Stewart Howe. In this broadcast listeners will be hearing us go around the BOILER ROOM on a veritable feast of topics including Cloppers, GOP Politics, Donald Trump, Hunting with Dick Cheney, Fat Shaming and the Golden Corral, the 5th anniversary of the NATO sacking of Libya, TX arresting people for outstanding student loan debt, the death of Supreme Court Justice Scalia, Glen Beck telling listeners that Ted Cruz will get them through the rapture, Mark Levin calling Donald Trump a  kooky truther,  Jim Baker selling buckets of Food and more. If you want to participate, bring something interesting to throw into the boiler Join us in the ALTERNATE CURRENT RADIO chat room.BOILER ROOM IS NOT A POLITICALLY CORRECT ZONE!  LIVE ACR PLAYER BELOW   Show goes live at 6 PM PST:",0
"21st Century Wire asks What really happened in the death of Supreme Court Justice Antonin Scalia?With the United States deep in the throes of the 2016 presidential primaries, the sudden death of Supreme Court Justice Antonin Scalia has provided a controversial backdrop to an already tense electoral race.Reports state that the 79-year-old conservative justice was found dead this past Saturday in his hotel room at Cibolo Creek Ranch, a luxury ranch located in Presidio County, Texas.  NO COUNTRY FOR OLD MEN    Several Hollywood films have been shot in the surrounding areas of Cibolo Creek Ranch, including the haunting motion picture No Country For Old Men. (Photo cctoaks.com)The San Antonio Express-News reported that ranch owner, John Poindexter, discovered Scalia s body three hours after first visiting the deceased jurist s hotel room at 8:30 in the morning on Saturday: We discovered the judge in bed, a pillow over his head. His bed clothes were unwrinkled,  the Cibolo Ranch owner told reporters on Monday.  He was lying very restfully. It looked like he had not quite awakened from a nap. As several days have now passed, various theories have surfaced in the aftermath of Scalia s death, causing Poindexter to further clarify his eyewitness account with the Daily News: There was a pillow over his head, not over his face,  said Poindexter.  The face was entirely clear. One of the most troubling aspects of Scalia s death, aside from lack of an autopsy being performed or that Presidio County Judge Cinderela Guevara pronounced the manner of his death over the phone without being present. Later, Guevara appears to have reversed her previous statement claiming that Scalia had died of a  heart attack , revising the cause of death to  natural causes . Resort owner and Democrat Party financier John Poindexter pictured with President Obama.It should also be noted that the resort owner, John Poindexter, is a prominent Democrat Party donor and Obama Award Winner.Another disturbing fact: Justice Scalia was a key vote in temporarily blocking the Clean Power Plan crafted by the White House, a set of new EPA climate regulations, as reported by The Atlantic: On Tuesday [February 9th], the Supreme Court ruled 5-4 that the rules should neither be implemented nor enforced until the high court itself heard their opponents  case. This was itself unprecedented: Never before had the Supreme Court stayed a set of regulations before a federal court even heard the initial case about them. With the Clean Power Plan looming, there are several upcoming and potentially historic  Supreme Court cases that could be impacted by Scalia s death.Over the years, some have questioned Scalia s various hunting trips and political connections as reported by the LA Times: Scalia engendered criticism in the past over his choice of partners on hunting trips. In 2001, he went on a pheasant hunting trip with the dean of a Kansas law school who was the lead attorney in two cases that were about to come before the Supreme Court. And in 2004, he went duck hunting with then-Vice President Dick Cheney   flying with him on a plane that served as Air Force 2  while the high court was considering a case that challenged the secrecy of an energy task force led by Cheney. Many questions still remain in the death of Supreme Court Justice Antonin Scalia   which will no doubt prompt speculation well into the foreseeable future.No More Fake News reports below   TIPPING THE BALANCE    Supreme Court Justice Antonin Scalia.  (Photo dallasnews)By John RappoportLet s jump right in with quotes from the Washington Post, 2/15,  Conspiracy theories swirl around the death of Antonin Scalia . The Post published extraordinary statements from the Facebook page of  William O. Ritchie, former head of criminal investigations for D.C. police : As a former homicide commander, I am stunned that no autopsy was ordered for Justice Scalia. You have a Supreme Court Justice who died, not in attendance of a physician. You have a non-homicide trained US Marshal tell the justice of peace that no foul play was observed. You have a justice of the peace pronounce death while not being on the scene and without any medical training opining that the justice died of a heart attack. What medical proof exists of a myocardial Infarction? Why not a cerebral hemorrhage? How can the Marshal say, without a thorough post mortem, that he was not injected with an illegal substance that would simulate a heart attack Did the US Marshal check for petechial hemorrhage in his eyes or under his lips that would have suggested suffocation? Did the US Marshal smell his breath for any unusual odor that might suggest poisoning? My gut tells me there is something fishy going on in Texas. If this isn t enough, the Post goes on: Scalia s physician, Brian Monahan, is a U.S. Navy rear admiral and the attending physician for the U.S. Congress and Supreme Court. He declined to comment on Scalia s [prior] health when reached by telephone Monday at his home in Maryland. Patient confidentiality forbids me to make any comment on the subject,  he said. When asked whether he planned to make public the statement he s preparing for [Texas Judge] Guevara, Monahan repeated the same statement and hung up on a reporter. As long as no law-enforcement investigation of Scalia s death is launched, the doctor is justified. Confidentiality applies, unless Scalia s family lifts it. But if such an investigation is opened, all bets are off. Confidentiality no longer applies.There are reports that, after Scalia s body was transported from the celebrity ranch in Texas, closely guarded and shielded by a bevy of marshals, it was rapidly embalmed. If so, that would apparently make toxicological tests far more difficult or impossible.As for a murder motive, try: upsetting the voting balance of the US Supreme Court. Try: a push to appoint a new Justice now, thus ensuring the appointee s political persuasion, regardless of the outcome of the 2016 Presidential election.Continue this story at No More Fake NewsREAD MORE ELECTION NEWS AT: 21st Century Wire 2016 Files",0
"21st Century Wire asks The tragic death of Kurt Cobain has mystified the public for more than two decades and over that time, many questionable forensic elements have come to light surrounding the singer s sudden end.We re asking our readers, should law enforcement Reopen the Kurt Cobain Case? READ MORE KURT COBAIN NEWS AT: 21st Century Wire Cobain Files",0
"21st Century Wire says It s been almost two years since the cloud storage provider Dropbox appointed former Secretary of State Condoleezza Rice to its board. A move Edward Snowden, at the time, called  hostile  for data privacy. Snowden s comments on the matter first appeared in a video interview conducted by the Guardian, and were published in a July 17, 2014 article: Dropbox is a targeted you know wannabe PRISM partner,  he told the Guardian. They just put   Condoleezza Rice on their board  who is probably the most anti-privacy official you can imagine. She s one of the ones who oversaw Stellar Wind and thought it was a great idea. So they re very hostile to privacy. PRISM: The NSA s data collection surveillance program that every citizen should know about. PRISM and Stellar Wind were both approved and implemented during President George W. Bush s administration.  (Image: (c) Adam Hart-Davis)Dropbox and other popular cloud storage providers hold the encryption keys to hand over to the NSA should a request for your data be approved.Snowden endorses zero knowledge  systems. In layman s terms, this means that cloud storage providers NOT hostile to data privacy don t just encrypt your data, but actually host your data without their ability to access it   ever. They have zero knowledge of the contents of your data. It s a big distinction, but one easily missed by a public inundated with confusing doublespeak on data privacy.Snowden adds that s the only way they can prove to the customers that they can be trusted with their information, and makes specific reference to one cloud company, SpiderOak, as a provider of zero knowledge systems. READ MORE SCI-TECH NEWS AT: 21st Century Wire Sci-Tech FilesSEE ALSO: 21st Century Wire NSA Files",0
